{
  "air_defense_systems": [
    "A01",
    "A02"
  ],
  "candidate_positions": [
    {
      "id": "C001",
      "x": 0,
      "y": 0
    },
    {
      "id": "C002",
      "x": 1,
      "y": 0
    },
    {
      "id": "C003",
      "x": 2,
      "y": 0
    },
    {
      "id": "C004",
      "x": 3,
      "y": 0
    },
    {
      "id": "C005",
      "x": 4,
      "y": 0
    },
    {
      "id": "C006",
      "x": 5,
      "y": 0
    },
    {
      "id": "C007",
      "x": 6,
      "y": 0
    },
    {
      "id": "C008",
      "x": 7,
      "y": 0
    },
    {
      "id": "C009",
      "x": 8,
      "y": 0
    },
    {
      "id": "C010",
      "x": 9,
      "y": 0
    },
    {
      "id": "C011",
      "x": 0,
      "y": 1
    },
    {
      "id": "C012",
      "x": 1,
      "y": 1
    },
    {
      "id": "C013",
      "x": 2,
      "y": 1
    },
    {
      "id": "C014",
      "x": 3,
      "y": 1
    },
    {
      "id": "C015",
      "x": 4,
      "y": 1
    }
  ],
  "position_suitability": {
    "C001": 1,
    "C002": 1,
    "C003": 1,
    "C004": 0,
    "C005": 1,
    "C006": 0,
    "C007": 1,
    "C008": 0,
    "C009": 1,
    "C010": 1,
    "C011": 1,
    "C012": 0,
    "C013": 1,
    "C014": 1,
    "C015": 1
  },
  "defense_radius": 3.5,
  "drone_start_point": {
    "x": 0,
    "y": 0
  },
  "drone_entry_point": {
    "x": 12,
    "y": 9
  },
  "terrain_or_grid_cost_data": {
    "candidate_height": {
      "C001": 12.1,
      "C002": 14.2,
      "C003": 16.3,
      "C004": 18.4,
      "C005": 20.5,
      "C006": 10.7,
      "C007": 12.8,
      "C008": 14.9,
      "C009": 17.0,
      "C010": 19.1,
      "C011": 21.2,
      "C012": 11.4,
      "C013": 13.5,
      "C014": 15.6,
      "C015": 17.7,
      "C016": 19.8,
      "C017": 10.0,
      "C018": 12.1,
      "C019": 14.2,
      "C020": 16.3
    },
    "candidate_base_cost": {
      "C001": 1.08,
      "C002": 1.16,
      "C003": 1.24,
      "C004": 1.32,
      "C005": 1.4,
      "C006": 1.48,
      "C007": 1.56,
      "C008": 1.64,
      "C009": 1.0,
      "C010": 1.08,
      "C011": 1.16,
      "C012": 1.24,
      "C013": 1.32,
      "C014": 1.4,
      "C015": 1.48,
      "C016": 1.56,
      "C017": 1.64,
      "C018": 1.0,
      "C019": 1.08,
      "C020": 1.16
    }
  },
  "path_cost_weights": {
    "height": 0.35,
    "horizontal_rotation": 0.25,
    "inclination": 0.2,
    "fire_threat": 0.55
  },
  "swarm_interval_delta": 2.0,
  "path_planning_graph": {
    "nodes": [
      "C001",
      "C002",
      "C003",
      "C004",
      "C005",
      "C006",
      "C007",
      "C008",
      "C009",
      "C010",
      "C011",
      "C012",
      "C013",
      "C014",
      "C015",
      "C016",
      "C017",
      "C018",
      "C019",
      "C020"
    ],
    "edges": [
      {
        "from": "C001",
        "to": "C002",
        "length": 1.0
      },
      {
        "from": "C002",
        "to": "C003",
        "length": 1.1
      },
      {
        "from": "C003",
        "to": "C004",
        "length": 1.2
      },
      {
        "from": "C004",
        "to": "C005",
        "length": 1.3
      },
      {
        "from": "C005",
        "to": "C006",
        "length": 1.0
      },
      {
        "from": "C006",
        "to": "C007",
        "length": 1.1
      },
      {
        "from": "C007",
        "to": "C008",
        "length": 1.2
      },
      {
        "from": "C008",
        "to": "C009",
        "length": 1.3
      },
      {
        "from": "C009",
        "to": "C010",
        "length": 1.0
      },
      {
        "from": "C010",
        "to": "C011",
        "length": 1.1
      },
      {
        "from": "C011",
        "to": "C012",
        "length": 1.2
      },
      {
        "from": "C012",
        "to": "C013",
        "length": 1.3
      },
      {
        "from": "C013",
        "to": "C014",
        "length": 1.0
      },
      {
        "from": "C014",
        "to": "C015",
        "length": 1.1
      },
      {
        "from": "C015",
        "to": "C016",
        "length": 1.2
      },
      {
        "from": "C016",
        "to": "C017",
        "length": 1.3
      },
      {
        "from": "C017",
        "to": "C018",
        "length": 1.0
      },
      {
        "from": "C018",
        "to": "C019",
        "length": 1.1
      },
      {
        "from": "C019",
        "to": "C020",
        "length": 1.2
      }
    ]
  }
}
